Authors,Title,Year,Source,DOI,Abstract
"Abdelnabi, Sahar; Gomaa, Amr; Sivaprasad, Sarath; Schönherr, Lea; Fritz, Mario",LLM-Deliberation: Evaluating LLMs with Interactive Multi-Agent Negotiation Games,2024,ICLR 2024,,We propose using scorable negotiation games as a new evaluation framework for LLMs. We create a testbed of diverse text-based multi-agent multi-issue semantically rich negotiation games. Via a systematic zero-shot Chain-of-Thought prompting we show that agents can negotiate and consistently reach successful deals.
"Akata, Elif; Schulz, Lion; Coda-Forno, Julian; Oh, Seong Joon; Bethge, Matthias; Schulz, Eric",Playing repeated games with large language models,2025,Nature Human Behaviour,10.1038/s41562-025-02172-y,We propose to use behavioural game theory to study LLMs cooperation and coordination behaviour. We let different LLMs play finitely repeated 2x2 games with each other with human-like strategies and actual human players. LLMs perform particularly well at self-interested games like the iterated Prisoner's Dilemma family but behave suboptimally in coordination games like Battle of the Sexes.
"Bakhtin, Anton; Brown, Noam; Dinan, Emily; Farina, Gabriele; Flaherty, Colin; Fried, Daniel; Goff, Andrew; Gray, Jonathan; Hu, Hengyuan; Jacob, Athul Paul; Komeili, Mojtaba; Konath, Karthik; Kwon, Minae; Lerer, Adam; Lewis, Mike; Miller, Alexander H.; Mitts, Sandra; Renduchintala, Adithya; Roller, Stephen; Rowe, Dirk; Shi, Weiyan; Spisak, Joe; Wei, Alexander; Wu, David J.; Zhang, Hugh; Zijlstra, Markus",Human-level play in the game of Diplomacy by combining language models with strategic reasoning,2022,Science,10.1126/science.ade9097,We introduce Cicero the first AI agent to achieve human-level performance in Diplomacy a strategy game involving cooperation and competition that emphasizes natural language negotiation. Across 40 games Cicero achieved more than double the average score of human players and ranked in the top 10%.
"Davidson, Tim R.; Veselovsky, Veniamin; Josifoski, Martin; Peyrard, Maxime; Bosselut, Antoine; Kosinski, Michal; West, Robert",Evaluating Language Model Agency through Negotiations,2024,ICLR 2024,,We introduce an approach to evaluate language model agency using negotiation games. We test six widely used LLMs evaluating performance and alignment in both self-play and cross-play settings. Only closed-source models were able to complete these tasks and cooperative bargaining games proved most challenging.
"Gandhi, Kanishk; Sadigh, Dorsa; Goodman, Noah D.",Strategic Reasoning with Language Models,2023,NeurIPS 2023 Workshop on Foundation Models for Decision Making,,This paper introduces an approach using pretrained LLMs with few-shot chain-of-thought examples to enable strategic reasoning for AI agents. Strategies derived from systematically generated prompts generalize almost perfectly to new game structures alternate objectives and hidden information.
"Light, Jonathan; Cai, Min; Shen, Sheng; Hu, Ziniu",AvalonBench: Evaluating LLMs Playing the Game of Avalon,2023,NeurIPS 2023 Workshop on Foundation Models for Decision Making,,We explore the potential of LLM Agents in playing Resistance Avalon a strategic social deduction game. We introduce AvalonBench a comprehensive game environment for evaluating multi-agent LLM Agents. ChatGPT playing good-role got a win rate of 22.2% against rule-based bots while good-role bot achieves 38.2% win rate.
