"Duan J.; Zhang R.; Diffenderfer J.; Kailkhura B.; Sun L.; Stengel-Eskin E.; Bansal M.; Chen T.; Xu K.","Duan, Jinhao (58106370800); Zhang, Renming (58912997100); Diffenderfer, James (57191228180); Kailkhura, Bhavya (55694465200); Sun, Lichao (57193994946); Stengel-Eskin, Elias (57200079936); Bansal, Mohit (16466939600); Chen, Tianlong (57221072108); Xu, Kaidi (57205687721)","58106370800; 58912997100; 57191228180; 55694465200; 57193994946; 57200079936; 16466939600; 57221072108; 57205687721","GTBENCH: Uncovering the Strategic Reasoning Limitations of LLMs via Game-Theoretic Evaluations","2024","Advances in Neural Information Processing Systems","37","","","","","","https://www.scopus.com/inward/record.uri?eid=2-s2.0-105000548036&partnerID=40&md5=1ad8eb543d5f2d018732626536fe8279","As Large Language Models (LLMs) are integrated into critical real-world applications, their strategic and logical reasoning abilities are increasingly crucial. This paper evaluates LLMs' reasoning abilities in competitive environments through game-theoretic tasks, e.g., board and card games that require pure logic and strategic reasoning to compete with opponents. We first propose GTBENCH, a language-driven environment composing 10 widely-recognized tasks, across a comprehensive game taxonomy: complete versus incomplete information, dynamic versus static, and probabilistic versus deterministic scenarios. Then, we (1) Characterize the game-theoretic reasoning of LLMs; and (2) Perform LLM-vs.-LLM competitions as reasoning evaluation. We observe that (1) LLMs have distinct behaviors regarding various gaming scenarios; for example, LLMs fail in complete and deterministic games yet they are competitive in probabilistic gaming scenarios; (2) Most open-source LLMs, e.g., CodeLlama-34b-Instruct and Llama-2-70b-chat, are less competitive than commercial LLMs, e.g., GPT-4, in complex games, yet the recently released Llama-3-70b-Instruct makes up for this shortcoming. In addition, code-pretraining greatly benefits strategic reasoning, while advanced reasoning methods such as Chain-of-Thought (CoT) and Tree-of-Thought (ToT) do not always help. We further characterize the game-theoretic properties of LLMs, such as equilibrium and Pareto Efficiency in repeated games. Detailed error profiles are provided for a better understanding of LLMs' behavior. We hope our research provides standardized protocols and serves as a foundation to spur further explorations in the strategic reasoning of LLMs. © 2024 Neural information processing systems foundation. All rights reserved.","","","","38th Conference on Neural Information Processing Systems, NeurIPS 2024","9 December 2024 through 15 December 2024","Vancouver","207061","English","Conference paper","Final","","Scopus"
"Yin Y.","Yin, Yue (59734188700)","59734188700","Too Much Information? Investigating Information Disclosure in Auction Systems with LLM Simulations","2025","Conference on Human Factors in Computing Systems - Proceedings ","","","532","","","10.1145/3706599.3720022","https://www.scopus.com/inward/record.uri?eid=2-s2.0-105005772096&doi=10.1145%2F3706599.3720022&partnerID=40&md5=78c3c341e4efae180fdd095ce03bf8e3","Online advertising relies on auction systems to allocate advertisement impressions efficiently and maximize revenue. A defining characteristic of these systems is information asymmetry: publishers (auctioneers) have access to detailed data, while bidders rely on limited signals. Understanding how information disclosure strategies shape bidder behavior and auction outcomes is essential for designing adaptive, user-centered advertising systems. This paper introduces InfoBid, a simulation framework powered by large language models (LLMs) to study the impact of information signaling in auction environments. This simulation framework enables researchers to analyze how information disclosure affects decision-making and system performance. By offering a flexible and extensible testbed, InfoBid advances Human-Computer Interaction (HCI) methodologies for studying multi-agent interactions, adaptive decision-making, and information sharing in complex digital marketplaces. © 2025 Copyright held by the owner/author(s).","Digital Advertising System; Information Asymmetry; Large Language Models (LLMs); Mechanism Design; Multi-Agent Simulation; Strategic Information Disclosure","Bibliographies; Decision making; Electronic money; Electronic publishing; Glossaries; Reviews; Advertising systems; Digital advertizing; Digital advertizing system; Information asymmetry; Information disclosure; Language model; Large language model; Mechanism design; Multi-agents simulations; Strategic information disclosure; Open access","ACM SIGCHI","2025 CHI Conference on Human Factors in Computing Systems, CHI EA 2025","26 April 2025 through 1 May 2025","Yokohama","208611","English","Conference paper","Final","","Scopus"
"Chen J.; Sun J.; Li X.; Xin H.; Xue Y.; Xu Y.; Zhao H.","Chen, Junhao (57943347200); Sun, Jingbo (60136773300); Li, Xiang (59241220400); Xin, Haidong (59172204700); Xue, Yuhao (59938352300); Xu, Yibin (60136773400); Zhao, Hao (60135365900)","57943347200; 60136773300; 59241220400; 59172204700; 59938352300; 60136773400; 60135365900","LLMsPark: A Benchmark for Evaluating Large Language Models in Strategic Gaming Contexts","2025","EMNLP 2025 - 2025 Conference on Empirical Methods in Natural Language Processing, Findings of EMNLP 2025","","","","182","194","10.18653/v1/2025.findings-emnlp.12","https://www.scopus.com/inward/record.uri?eid=2-s2.0-105028982943&doi=10.18653%2Fv1%2F2025.findings-emnlp.12&partnerID=40&md5=37f7cfe59e90acf188d63e2ea2be7f6a","As large language models (LLMs) advance across diverse tasks, the need for comprehensive evaluation beyond single metrics becomes increasingly important. To fully assess LLM intelligence, it is crucial to examine their interactive dynamics and strategic behaviors. We present LLMsPark, a game theory-based evaluation platform that measures LLMs’ decision-making strategies and social behaviors in classic game-theoretic settings, providing a multi-agent environment to explore strategic depth. Our system cross-evaluates 15 leading LLMs (both commercial and open-source) using leaderboard rankings and scoring mechanisms. Higher scores reflect stronger reasoning and strategic capabilities, revealing distinct behavioral patterns and performance differences across models. This work introduces a novel perspective for evaluating LLMs’ strategic intelligence, enriching existing benchmarks and broadening their assessment in interactive, game-theoretic scenarios. The benchmark and rankings are publicly available at https://llmsparks.github.io/. ©2025 Association for Computational Linguistics.","","Behavioral research; Computational linguistics; Decision making; Decision theory; Game theory; Natural language processing systems; Comprehensive evaluation; Decision-making strategies; Dynamic behaviors; Evaluation platforms; Game-theoretic; Language model; Modeling decision makings; Social behaviour; Strategic Behavior; Theory-based evaluation; Multi agent systems","airbnb; Bailu; et al.; HPC-AI.COM; Miromind; Tencent","30th Conference on Empirical Methods in Natural Language Processing, EMNLP 2025","4 November 2025 through 9 November 2025","Suzhou","216600","English","Conference paper","Final","","Scopus"
"Proverbio D.; Buscemi A.; Di Stefano A.; Han T.A.; Castignani G.; Liò P.","Proverbio, Daniele (57218846528); Buscemi, Alessio (57221952039); Di Stefano, Alessandro (57064488800); Han, The Anh (37111026400); Castignani, German (35078062300); Liò, Pietro (7004223170)","57218846528; 57221952039; 57064488800; 37111026400; 35078062300; 7004223170","Can LLMs effectively provide game-theoretic-based scenarios for cybersecurity?","2025","Frontiers in Computer Science","7","","1703586","","","10.3389/fcomp.2025.1703586","https://www.scopus.com/inward/record.uri?eid=2-s2.0-105026480904&doi=10.3389%2Ffcomp.2025.1703586&partnerID=40&md5=68197b0572fd3f7fd067faf2530fdbc8","Introduction: Game theory has long served as a foundational tool in cybersecurity to test, predict, and design strategic interactions between attackers and defenders. The recent advent of Large Language Models (LLMs) offers new tools and challenges for the security of computer systems. In this work, we investigate whether classical game-theoretic frameworks can effectively capture the behaviors of LLM-driven actors and bots. Methods: Using a reproducible framework for game-theoretic LLM agents, we investigate two canonical scenarios—the one-shot zero-sum game and the dynamic Prisoner's Dilemma—and we test whether LLMs converge to expected outcomes or exhibit deviations due to embedded biases. We experiments on four state-of-the-art LLMs and five natural languages (English, French, Arabic, Vietnamese, and Mandarin Chinese) to assess linguistic sensitivity. Results: For both games, we observe that the final payoffs are influenced by agents characteristics such as personality traits or knowledge of repeated rounds. We also uncover an unexpected sensitivity of the final payoffs to the choice of languages, which should warn against indiscriminate application of LLMs in cybersecurity applications and call for in-depth studies, as LLMs may behave differently when deployed in different countries. We also employ quantitative metrics to evaluate the internal consistency and cross-language stability of LLM agents. Discussion: In addition to uncovering unexpected behaviors requiring attention by scholars and practitioners, our work can help guide the selection of the most stable LLMs and optimizing models for secure applications. Copyright © 2025 Proverbio, Buscemi, Di Stefano, Han, Castignani and Liò.","cybersecurity; eavesdropping; game theory; generative AI; large language model; network security; Prisoner's Dilemma; zero-sum game","","","","","","","English","Article","Final","All Open Access; Gold Open Access; Green Open Access","Scopus"
"Zhang H.; Li P.; Dai M.; Wu Y.; Qian L.","Zhang, Hanwen (58678881900); Li, Peichun (57222054545); Dai, Minghui (57203149283); Wu, Yuan (24781596200); Qian, Liping (55241616100)","58678881900; 57222054545; 57203149283; 24781596200; 55241616100","Efficient Federated Learning With Quality-Aware Generated Models: An Incentive Mechanism","2025","IEEE Internet of Things Journal","12","2","","1628","1642","10.1109/JIOT.2024.3461329","https://www.scopus.com/inward/record.uri?eid=2-s2.0-85204534924&doi=10.1109%2FJIOT.2024.3461329&partnerID=40&md5=9e2c91a733eac4dc6fe8e96c303b6b91","Federated learning (FL) encounters slow convergence due to data heterogeneity issues. Recently, generative artificial intelligence (AI) has showcased remarkable capabilities in synthesizing realistic data. To effectively address the challenges of nonindependent and identically distributed (non-IID) data, this article introduces a collaborative AI training framework that leverages generative AI to enhance the learning performance of FL. In this framework, heterogeneous edge devices (HEDs) identify specific data categories lacking in their local data sets and acquire these data from generative AI providers (GAPs). This strategy aims to improve the convergence rate of FL. However, HEDs and GAPs may be reluctant to contribute their resources to FL training due to self-interest. Therefore, an incentive mechanism is necessary to encourage their participation. We propose a reverse auction model to facilitate data transactions among FL training buyers, GAPs, and HEDs within the FL training buyer's budget. It focuses on determining winners and devising payment rules to maximize the FL training buyer's utility. This involves solving a 0-1 programming problem with two sellers (GAPs and HEDs). To tackle this, we use joint bidding and virtual seller pairs for analysis. We demonstrate that our method ensures truthfulness, individual rationality, and computational efficiency. Furthermore, we employ a one-side matching mechanism to approximate the optimal solution. We further investigate a strategy to analyze and allocate data based on variance, aiming to minimize non-IID issues in local data. Simulation results demonstrate that our proposed matching mechanism can effectively improve the computational efficiency, with the test accuracy differing from the theoretical optimum by only about 0.7%, and our mechanism can outperform the other greedy algorithms. Additionally, our data allocation strategy enhances the test accuracy by approximately 7% compared to existing methods. © 2014 IEEE.","Data compensation; federated learning (FL); generative artificial intelligence (AI); incentive mechanism","Adversarial machine learning; Contrastive Learning; Data accuracy; Generative adversarial networks; Data compensation; Data heterogeneity; Distributed data; Generative artificial intelligence; Incentive mechanism; Learning performance; Matching mechanisms; Slow convergences; Test accuracy; Training framework; Federated learning","","","","","","English","Article","Final","","Scopus"
"Yan X.; Wang R.","Yan, Xiao (57221158033); Wang, Rui (57222028400)","57221158033; 57222028400","Dynamic Decision-Making in Tank War Game: An LLM-Based AI Framework","2025","Proceedings of the 2nd International Conference on Artificial Intelligence of Things and Computing, AITC 2025","","","","27","31","10.1145/3762329.3762334","https://www.scopus.com/inward/record.uri?eid=2-s2.0-105020383221&doi=10.1145%2F3762329.3762334&partnerID=40&md5=9d70c5bd74c5089778563e74559181b8","This paper presents a novel framework for intelligent game AI in real-time 2D shooting games using large language models (LLMs), with Tank War as the testbed. Addressing the limitations of conventional rulebased systems and reinforcement learning approaches in dynamic combat scenarios. Leveraging the inherent interpretability and general-purpose nature of LLMs, our approach demonstrates superior cost-effectiveness and interpretability compared to reinforcement learning systems (requiring no specialized training) while outperforming rule-based architectures in adaptability and intelligence. To successfully and smoothly using LLMs in the game, we propose a hierarchical decision-making architecture that synergizes LLM-based strategic reasoning with real-time tactical execution. Specifically, In the strategic reasoning stage, a LLM is responsible for dispatching tanks to the most suitable destination in order to protect the base or attack the enemy or to wait for an opportunity. In the tactical execution stage, we construct a automatic attack module for attacking enemies in allowed distance, and a path planning module for generating a series of optimal moving actions to the destination and avoid obstacles according to the LLM's output. This work not only advances real-time game AI capabilities but also provides insights for applying LLMs in time-sensitive interactive systems. © 2025 Copyright held by the owner/author(s).","Decision-Making Process; Deep learning; Intelligent Agent; Large Language Model (LLM)","Behavioral research; Computer games; Cost effectiveness; Decision making; Deep learning; Deep reinforcement learning; Game theory; Human computer interaction; Interactive computer systems; Memory architecture; Motion planning; Real time systems; Reinforcement learning; Tanks (containers); Tanks (military); Decision-making process; Deep learning; Game AI; Interpretability; Language model; Large language model; Model-based OPC; Real- time; Strategic reasoning; Tacticals; Intelligent agents","","2nd International Conference on Artificial Intelligence of Things and Computing, AITC 2025","25 July 2025 through 27 July 2025","Hangzhou","213010","English","Conference paper","Final","All Open Access; Gold Open Access","Scopus"
"Suzuki R.; Arita T.","Suzuki, Reiji (8412270300); Arita, Takaya (8412270200)","8412270300; 8412270200","Evolutionary Ecology of Words","2025","2025 IEEE Symposium on Computational Intelligence in Artificial Life and Cooperative Intelligent Systems, ALIFE-CIS 2025","","","","","","10.1109/ALIFE-CIS64968.2025.10979831","https://www.scopus.com/inward/record.uri?eid=2-s2.0-105005137203&doi=10.1109%2FALIFE-CIS64968.2025.10979831&partnerID=40&md5=52549c59a29c429838894f1be16e8022","We propose a model for the evolutionary ecology of words as one attempt to extend evolutionary game theory and agent-based models by utilizing the rich linguistic expressions of Large Language Models (LLMs). Our model enables the emergence and evolution of diverse and infinite options for interactions among agents. Within the population, each agent possesses a short word (or phrase) generated by an LLM and moves within a spatial environment. When agents become adjacent, the outcome of their interaction is determined by the LLM based on the relationship between their words, with the loser's word being replaced by the winner's. Word mutations, also based on LLM outputs, may occur. We conducted preliminary experiments assuming that 'strong animal species' would survive. The results showed that from an initial population consisting of well-known species, many species emerged both gradually and in a punctuated equilibrium manner. Each trial demonstrated the unique evolution of diverse populations, with one type of large species becoming dominant, such as terrestrial animals, marine life, or extinct species, which were ecologically specialized and adapted ones across diverse extreme habitats. We also conducted a long-term experiment with a large population, demonstrating the emergence and coexistence of diverse species. © 2025 IEEE.","agent-based models; artificial life; evolutionary game theory; large language models","Abiotic; Invertebrates; Livestock; Mammals; Agent-based model; Artificial Life; Evolutionary ecology; Evolutionary game theory; Game-theory based model; Language model; Large language model; Linguistic expressions; Model-based OPC; Spatial environments; Biotic","","2025 IEEE Symposium on Computational Intelligence in Artificial Life and Cooperative Intelligent Systems, ALIFE-CIS 2025","17 March 2025 through 20 March 2025","Trondheim","208620","English","Conference paper","Final","All Open Access; Green Open Access","Scopus"
"Xu Z.; Zhang Q.; Lin J.; Wen F.; Mu J.; Zou Y.; Ding Y.; Lin Z.; He J.","Xu, Zeling (59714601000); Zhang, Qianqi (59936114400); Lin, Jianzhi (60262867300); Wen, Fange (60262512600); Mu, Jia (60262159500); Zou, Yuntao (57469406900); Ding, Yaoyao (57814217700); Lin, Zihui (58154171500); He, Jie (56767283600)","59714601000; 59936114400; 60262867300; 60262512600; 60262159500; 57469406900; 57814217700; 58154171500; 56767283600","Cognitive-Enhanced Hierarchical Coordination for Lunar Energy Storage IoT Systems","2025","BlockNetSys 2025 - Proceedings of the 2025 ACM CoNEXT Workshop on Blockchain-Network Synergy, Co-Located with CoNEXT 2025","","","","18","24","10.1145/3769698.3771225","https://www.scopus.com/inward/record.uri?eid=2-s2.0-105026283164&doi=10.1145%2F3769698.3771225&partnerID=40&md5=f7e3b174cceee60f045fdb22c2808694","The lunar energy storage base, comprising an Internet of Things (IoT) system of hundreds of heterogeneous energy storage nodes, directly influences the success of deep space exploration missions. However, traditional centralized control architectures face severe challenges including semantic understanding deficits and single-point-of-failure risks. The extreme lunar environment amplifies minor energy allocation deviations exponentially, while the strong emergent properties of energy storage IoT networks invalidate the decomposable and predictable assumptions of conventional control theory. Addressing this core challenge of coordinated control in IoT systems, we present an innovative cognition-enhanced hierarchical coordination framework that deeply integrates the semantic understanding capabilities of large language models with the incentive design mechanisms of Stackelberg game theory. This framework models each energy storage node as a cognitive-capable agent, enabling the IoT system to directly comprehend operational objectives described in natural language and dynamically generate corresponding mathematical constraints. Through carefully designed incentive mechanisms within a hierarchical game structure, the framework ensures that individual agents spontaneously achieve system-level coordination while pursuing their own optimization objectives. Experimental results demonstrate that this framework significantly enhances the coordination performance of IoT systems, providing a novel theoretical foundation and practical solution for intelligent management of lunar energy storage systems and complex IoT systems in future deep space exploration missions.  © 2025 ACM.","cognitive agents; iot coordination; lunar energy storage; semantic understanding; stackelberg game","Cognitive systems; Computation theory; Coordination reactions; Data storage equipment; Energy storage; Hierarchical systems; Intelligent agents; Safety engineering; Semantics; Space research; Storage management; Cognitive agents; Deep-space exploration; Energy; Hierarchical coordination; Iot coordination; Lunar energy storage; Semantics understanding; Space exploration mission; Stackelberg Games; Storage nodes; Lunar missions","ACM SIGCOMM","2025 ACM CoNEXT Workshop on Blockchain-Network Synergy, BlockNetSys 2025","1 December 2025 through 4 December 2025","Hong Kong","215475","English","Conference paper","Final","All Open Access; Gold Open Access","Scopus"
"Mensfelt A.; Stathis K.; Trencsenyi V.","Mensfelt, Agnieszka (57021730700); Stathis, Kostas (6603084945); Trencsenyi, Vince (59328511400)","57021730700; 6603084945; 59328511400","Towards Logically Sound Natural Language Reasoning with Logic-Enhanced Language Model Agents","2025","Proceedings - International Conference on Tools with Artificial Intelligence, ICTAI","","","","838","842","10.1109/ICTAI66417.2025.00122","https://www.scopus.com/inward/record.uri?eid=2-s2.0-105031894963&doi=10.1109%2FICTAI66417.2025.00122&partnerID=40&md5=1217cf87534ea4de15d8e5f7db7434a7","Large language models (LLMs) are increasingly explored as general-purpose reasoners, particularly in agentic contexts. However, their outputs remain prone to mathematical and logical errors. This is especially challenging in open-ended tasks, where unstructured outputs lack explicit ground truth and may contain subtle inconsistencies. To address this issue, we propose Logic-Enhanced Language Model Agents (LELMA), a framework that integrates LLMs with formal logic to enable validation and refinement of natural language reasoning. LELMA comprises three components: an LLM-Reasoner, an LLM-Translator, and a Solver, and employs autoformalization to translate reasoning into logic representations, which are then used to assess logical validity. Using game-theoretic scenarios such as the Prisoner's Dilemma as testbeds, we highlight the limitations of both less capable (Gemini 1.0 Pro) and advanced (GPT4o) models in generating logically sound reasoning. LELMA achieves high accuracy in error detection and improves reasoning correctness via self-refinement, particularly in GPT-4o. The study also highlights challenges in autoformalization accuracy and in evaluation of inherently ambiguous open-ended reasoning tasks. © 2025 IEEE.","Autoformalization; Large Language Models; Logical Validation; Natural Language Reasoning","Computational linguistics; Computer circuits; Formal logic; Game theory; Natural language processing systems; Autoformalization; Ground truth; Language model; Large language model; Logical errors; Logical validation; Model agents; Natural language reasoning; Natural languages; Reasoners; Agents","Biological and Artificial Intelligence Foundation (BAIF); Computer Society of the IEEE; Institute of Electrical and Electronic Engineers (IEEE)","37th IEEE International Conference on Tools with Artificial Intelligence, ICTAI 2025","3 November 2025 through 5 November 2025","Athens","218234","English","Conference paper","Final","","Scopus"
