"Deng S.; Wang Y.; Savani R.","Deng, Shilong (58827548100); Wang, Yongzhao (57209914283); Savani, Rahul (8367551600)","58827548100; 57209914283; 8367551600","From Natural Language to Extensive-Form Game Representations","2025","Proceedings of the International Joint Conference on Autonomous Agents and Multiagent Systems, AAMAS","","","","593","601","","https://www.scopus.com/inward/record.uri?eid=2-s2.0-105009791190&partnerID=40&md5=0148081aa959ca796d9f01d6c4e11a1e","We introduce a framework for translating game descriptions in natural language into game-theoretic extensive-form representations, leveraging Large Language Models (LLMs) and in-context learning. We find that a naive application of in-context learning struggles on this problem, in particular with imperfect information. To address this, we introduce GameInterpreter, a two-stage framework with specialized modules to enhance in-context learning, enabling it to divide and conquer the problem effectively. In the first stage, we tackle the challenge of imperfect information by developing a module that identifies information sets and the corresponding partial tree structure. With this information, the second stage leverages in-context learning alongside a self-debugging module to produce a complete extensive-form game tree represented using pygambit, the Python API of a recognized game-theoretic analysis tool called Gambit. Using this python representation enables the automation of tasks such as computing Nash equilibria directly from natural language descriptions. We evaluate the performance of the full framework, as well as its individual components, using various LLMs on games with different levels of strategic complexity. Our experimental results show that the framework significantly outperforms baseline approaches in generating accurate extensive-form games, with each module playing a critical role in its success. © 2025 International Foundation for Autonomous Agents and Multiagent Systems (www.ifaamas.org).","Code Generation; Extensive-Form Games; Gambit; Game Translation; Large Language Models","Autonomous agents; Computational linguistics; Computer games; Forestry; Game theory; High level languages; Natural language processing systems; Program debugging; Python; Translation (languages); Trees (mathematics); Codegeneration; Context learning; Extensive-form games; Gambit; Game translation; Imperfect information; In contexts; Language model; Large language model; Natural languages; Multi agent systems","Artificial Intelligence; Cooperative AI; DeepMind; et al.; Jane Street; Visit Detroit","24th International Conference on Autonomous Agents and Multiagent Systems, AAMAS 2025","19 May 2025 through 23 May 2025","Detroit","209812","English","Conference paper","Final","","Scopus"
"Wang M.; Ma C.; Chen Q.; Meng L.; Han Y.; Xiao J.; Zhang Z.; Huo J.; Su W.J.; Yang Y.","Wang, Mingzhi (58913145900); Ma, Chengdong (57817034000); Chen, Qizhi (57948953800); Meng, Linjian (57549266600); Han, Yang (59445592600); Xiao, Jiancong (57933757400); Zhang, Zhaowei (58389061500); Huo, Jing (55336296400); Su, Weijie J. (56735141600); Yang, Yaodong (58886173200)","58913145900; 57817034000; 57948953800; 57549266600; 59445592600; 57933757400; 58389061500; 55336296400; 56735141600; 58886173200","MAGNETIC PREFERENCE OPTIMIZATION: ACHIEVING LAST-ITERATE CONVERGENCE FOR LANGUAGE MODEL ALIGNMENT","2025","13th International Conference on Learning Representations, ICLR 2025","","","","67580","67611","","https://www.scopus.com/inward/record.uri?eid=2-s2.0-105010267588&partnerID=40&md5=6de2d16c4687887a0ad19683a0ca7f96","Self-play methods have demonstrated remarkable success in enhancing model capabilities across various domains. In the context of Reinforcement Learning from Human Feedback (RLHF), self-play not only boosts Large Language Model (LLM) performance but also overcomes the limitations of traditional Bradley-Terry (BT) model assumptions by finding the Nash equilibrium (NE) of a preference-based, two-player constant-sum game. However, existing methods either guarantee only average-iterate convergence, incurring high storage and inference costs, or converge to the NE of a regularized game, failing to accurately reflect true human preferences. In this paper, we introduce Magnetic Preference Optimization (MPO), a novel approach capable of achieving last-iterate convergence to the NE of the original game, effectively overcoming the limitations of existing methods. Building upon Magnetic Mirror Descent (MMD), MPO attains a linear convergence rate, making it particularly suitable for fine-tuning LLMs. To ensure our algorithm is both theoretically sound and practically viable, we present a simple yet effective implementation that adapts the theoretical insights to the RLHF setting. Empirical results demonstrate that MPO can significantly enhance the performance of LLMs, highlighting the potential of self-play methods in alignment. © 2025 13th International Conference on Learning Representations, ICLR 2025. All rights reserved.","","Game theory; Learning systems; Nash equilibrium; Optimization; Bradley-Terry models; Constant-sum game; Language model; Model assumptions; Modeling performance; Nash equilibria; Preference optimizations; Preference-based; Reinforcement learnings; Self-play; Alignment","","13th International Conference on Learning Representations, ICLR 2025","24 April 2025 through 28 April 2025","Singapore","209472","English","Conference paper","Final","","Scopus"
"Kong D.; Yan X.; Chen M.; Han S.; Chen J.; Huang F.","Kong, Dexin (59660156500); Yan, Xu (58546801800); Chen, Ming (59659776000); Han, Shuguang (55364695500); Chen, Jufeng (57890895900); Huang, Fei (57210150087)","59660156500; 58546801800; 59659776000; 55364695500; 57890895900; 57210150087","FishBargain: An LLM-Empowered Bargaining Agent for Online Fleamarket Platform Sellers","2025","WWW Companion 2025 - Companion Proceedings of the ACM Web Conference 2025","","","","2855","2858","10.1145/3701716.3715176","https://www.scopus.com/inward/record.uri?eid=2-s2.0-105009231660&doi=10.1145%2F3701716.3715176&partnerID=40&md5=cbbbee1f455104e2f3e4863f03c06a37","Different from traditional Business-to-Consumer e-commerce platforms (e.g., Amazon), online fleamarket platforms (e.g., Craigslist) mainly focus on individual sellers who are lack of time investment and business proficiency. Individual sellers often struggle with the bargaining process and thus the deal is unaccomplished. Recent advancements in Large Language Models(LLMs) demonstrate huge potential in various dialogue tasks, but those tasks are mainly in the form of passively following user's instruction. Bargaining, as a form of proactive dialogue task, represents a distinct art of dialogue considering the dynamism of environment and uncertainty of adversary strategies. In this paper, we propose an LLM-empowered bargaining agent designed for online fleamarket platform sellers, named as FishBargain. Specifically, FishBargain understands the chat context and product information, chooses both action and language skill considering possible adversary actions and generates utterances. FishBargain has been tested by thousands of individual sellers on one of the largest online fleamarket platforms (Xianyu) in China. Both qualitative and quantitative experiments demonstrate that FishBargain can effectively help sellers make more deals. © 2025 Copyright held by the owner/author(s). Publication rights licensed to ACM.","Bargaining; Large Language Model; Proactive Dialogue","Electronic commerce; Investments; Bargaining; Business to consumer E commerces; Commerce platforms; Context information; Language model; Large language model; Proactive dialog; Product information; Qualitative experiments; Uncertainty; Computational linguistics","ACM SIGWEB; Baidu; et al.; Google; Huawei; Meta","34th ACM Web Conference, WWW Companion 2025","28 April 2025 through 2 May 2025","Sydney","209280","English","Conference paper","Final","All Open Access; Gold Open Access","Scopus"
"Fan C.; Chen J.; Jin Y.; He H.","Fan, Caoyun (57224500636); Chen, Jindou (57488679700); Jin, Yaohui (58637202300); He, Hao (55214927000)","57224500636; 57488679700; 58637202300; 55214927000","Can Large Language Models Serve as Rational Players in Game Theory? A Systematic Analysis","2024","Proceedings of the AAAI Conference on Artificial Intelligence","38","16","","17960","17967","10.1609/aaai.v38i16.29751","https://www.scopus.com/inward/record.uri?eid=2-s2.0-85180300663&doi=10.1609%2Faaai.v38i16.29751&partnerID=40&md5=28297e69476e834b806fcd7ac1ce9862","Game theory, as an analytical tool, is frequently utilized to analyze human behavior in social science research. With the high alignment between the behavior of Large Language Models (LLMs) and humans, a promising research direction is to employ LLMs as substitutes for humans in game experiments, enabling social science research. However, despite numerous empirical researches on the combination of LLMs and game theory, the capability boundaries of LLMs in game theory remain unclear. In this research, we endeavor to systematically analyze LLMs in the context of game theory. Specifically, rationality, as the fundamental principle of game theory, serves as the metric for evaluating players’ behavior — building a clear desire, refining belief about uncertainty, and taking optimal actions. Accordingly, we select three classical games (dictator game, Rock-Paper-Scissors, and ring-network game) to analyze to what extent LLMs can achieve rationality in these three aspects. The experimental results indicate that even the current state-of-the-art LLM (GPT-4) exhibits substantial disparities compared to humans in game theory. For instance, LLMs struggle to build desires based on uncommon preferences, fail to refine belief from many simple patterns, and may overlook or modify refined belief when taking actions. Therefore, we consider that introducing LLMs into game experiments in the field of social science should be approached with greater caution. Copyright © 2024, Association for the Advancement of Artificial Intelligence (www.aaai.org). All rights reserved.","","Behavioral research; Computational linguistics; Computer games; Analytical tool; Empirical research; Fundamental principles; Human behaviors; Language games; Language model; Player behavior; Rational players; Social science research; Systematic analysis; Game theory","Association for the Advancement of Artificial Intelligence","38th AAAI Conference on Artificial Intelligence, AAAI 2024","20 February 2024 through 27 February 2024","Vancouver","198370","English","Conference paper","Final","All Open Access; Gold Open Access","Scopus"
"Lv Y.; Yang J.; Sun X.; Wu H.","Lv, Yali (57213543794); Yang, Jian (57091208300); Sun, Xiaoning (57193139156); Wu, Huafei (59559896200)","57213543794; 57091208300; 57193139156; 59559896200","Evolutionary game analysis of stakeholder privacy management in the AIGC model","2025","Operations Research Perspectives","14","","100327","","","10.1016/j.orp.2025.100327","https://www.scopus.com/inward/record.uri?eid=2-s2.0-85217918133&doi=10.1016%2Fj.orp.2025.100327&partnerID=40&md5=1964c22fb783758a3ecaca0ac641dcad","The technological development powered by Artificial Intelligence Generated Content (AIGC) models, exemplified by Generative Pre-trained Transformer 4 (GPT-4) and Bidirectional Encoder Representations from Transformers (BERT), has completely transformed machine language processing and fostered substantial technological advancements. However, their extensive deployment has amplified concerns regarding data privacy risks, which are attributed not only to technological vulnerabilities but also to the intricate conflicts of interest among model providers, application service providers, and privacy regulators. To tackle this challenge, this research develops a tripartite evolutionary game model that examines the strategic interactions and dynamic relationships among large language model providers, application service providers, and privacy regulatory agencies. By employing replicator dynamic equations and Jacobian matrices, the research investigates the stability of strategic equilibria and simulates optimal adjustment paths across diverse policy scenarios. Drawing on the research findings, this paper offers practical recommendations to strengthen data privacy protection in large language models, delivering a solid theoretical foundation for policymakers and industry practitioners. © 2025","AIGC; Data privacy; Evolutionary game; Replicator dynamic equations","","","","","","","English","Article","Final","All Open Access; Gold Open Access; Green Open Access","Scopus"
"Mouri Zadeh Khaki A.; Choi A.; Seyyed-Kalantari L.","Mouri Zadeh Khaki, Ahmad (59505780900); Choi, Ahyoung (57193550851); Seyyed-Kalantari, Laleh (57196222922)","59505780900; 57193550851; 57196222922","Simulating Social Behavior of LLM-Based Autonomous Negotiator Agents in a Game-Theoretical Framework Using Multi-Agent Systems","2025","International Journal of Human-Computer Interaction","41","23","","15169","15178","10.1080/10447318.2025.2495117","https://www.scopus.com/inward/record.uri?eid=2-s2.0-105005522808&doi=10.1080%2F10447318.2025.2495117&partnerID=40&md5=764b04fd3a45090216a3829bf68be7d2","Simulation is a widely used approach for evaluating system performance, robustness, and potential issues during design and testing. Large Language Models (LLMs) have recently shown strong potential in autonomous agent systems, including negotiation tasks—a core aspect of commerce. This paper evaluates LLM-based autonomous negotiator agents (LANAs) in a buyer-seller bargaining game to assess their decision-making and reasoning. We simulate interactions between agents embodying contrasting social behaviors: (a) Cunning vs. Kind, and (b) Greedy vs. Generous. By analyzing both the game outcomes and the agents’ internal reasoning, we find that LLMs can effectively simulate distinct social behaviors in both dialogue and decision-making. Our results offer insights into how social traits affect negotiation dynamics, emphasizing the importance of clear policy design to ensure fairness and reliability in LANA-based systems. © 2025 Taylor & Francis Group, LLC.","Decision-making; game theory; large language models; multi-agent systems; social behavior; strategic reasoning","Autonomous agents; Economic and social effects; Emotional intelligence; Risk perception; Social behavior; Social psychology; Decisions makings; Evaluating systems; Game-theoretical framework; Language model; Large language model; Model-based OPC; Multiagent systems (MASs); Social behaviour; Strategic reasoning; System robustness; Consumer behavior","","","","","","English","Article","Final","","Scopus"
"Tamer O.A.; Gümüş A.","Tamer, Onat Arda (60197751300); Gümüş, Abdurrahman (35315599800)","60197751300; 35315599800","CollabPersona: A Framework for Collaborative Decision Analysis in Persona Driven LLM-Based Multi-Agent Systems","2025","IEEE International Workshop on Machine Learning for Signal Processing, MLSP","","","","","","10.1109/MLSP62443.2025.11204223","https://www.scopus.com/inward/record.uri?eid=2-s2.0-105022136570&doi=10.1109%2FMLSP62443.2025.11204223&partnerID=40&md5=e718990add4372718d5a0a6418a0822b","Large Language Model (LLM) agents have recently demonstrated impressive capabilities in single agent and adversarial settings, but their ability to collaborate effectively with minimal communication remains uncertain. We introduce CollabPersona, a simulation framework that combines persona-grounded memory with one-shot feedback to study team-based reasoning among LLM agents. In a multi-round variant of the Guess 0.8 of the Average game, agents reason entirely through structured prompts without fine-tuning. Our results show that minimal feedback significantly improves intra-team coordination and stabilizes strategic behavior, while cognitive style remains a primary driver of competitive outcomes. These findings suggest that lightweight scaffolding can elicit emergent collaboration in LLM agents and provide a flexible platform for studying cooperative intelligence.  © 2025 IEEE.","Collaborative Reasoning; Game Theory; Large Language Models; Multi-Agent Systems; Persona-Based Agents","Behavioral research; Computational methods; Decision theory; Distributed computer systems; Feedback; Human resource management; Intelligent agents; Multi agent systems; Collaborative decisions; Collaborative reasonings; Language model; Large language model; Model agents; Model-based OPC; Multiagent systems (MASs); Persona-based agent; Simulation framework; Single-agent; Game theory","Adobe; Data Force; et al.; Huawei; Machine Learning for Signal Processing (MLSP) Technical Committee of the IEEE Signal Processing Society; Openzeka","35th IEEE International Workshop on Machine Learning for Signal Processing, MLSP 2025","31 August 2025 through 3 September 2025","Istanbul","214260","English","Conference paper","Final","","Scopus"
"Wang H.; Zhao S.; Wang J.; Qiang Z.; Qin B.; Liu T.","Wang, Haochun (57899997800); Zhao, Sendong (55446331700); Wang, Jingbo (58747608700); Qiang, Zewen (58251684000); Qin, Bing (8575883100); Liu, Ting (57199476645)","57899997800; 55446331700; 58747608700; 58251684000; 8575883100; 57199476645","Beyond Frameworks: Unpacking Collaboration Strategies in Multi-Agent Systems","2025","Proceedings of the Annual Meeting of the Association for Computational Linguistics","1","","","21361","21375","10.18653/v1/2025.acl-long.1037","https://www.scopus.com/inward/record.uri?eid=2-s2.0-105021009139&doi=10.18653%2Fv1%2F2025.acl-long.1037&partnerID=40&md5=13acd25a66f35962da5f037a6d74135a","Multi-agent collaboration has emerged as a pivotal paradigm for addressing complex, distributed tasks in large language model (LLM)driven applications. While prior research has focused on high-level architectural frameworks, the granular mechanisms governing agents, critical to performance and scalability, remain underexplored. This study systematically investigates four dimensions of collaboration strategies: (1) agent governance, (2) participation control, (3) interaction dynamics, and (4) dialogue history management. Through rigorous experimentation under two context-dependent scenarios: Distributed Evidence Integration (DEI) and Structured Evidence Synthesis (SES), we quantify the impact of these strategies on both task accuracy and computational efficiency. Our findings reveal that centralized governance, instructor-led participation, ordered interaction patterns, and instructor-curated context summarization collectively optimize the trade-off between decision quality and resource utilization with the support of the proposed Token-Accuracy Ratio (TAR). This work establishes a foundation for designing adaptive, scalable multi-agent systems, shifting the focus from structural novelty to strategic interaction mechanics. © 2025 Association for Computational Linguistics.","","Computational efficiency; Computational linguistics; Intelligent agents; Multi agent systems; Agent collaboration; Architectural frameworks; Distributed tasks; Four dimensions; Granular mechanisms; Language model; Model-driven; Multi agent; Multiagent systems (MASs); Performance and scalabilities; Economic and social effects","Alibaba Cloud; Ant Group; Bloomberg Engineering; Citadel Securities","63rd Annual Meeting of the Association for Computational Linguistics, ACL 2025","27 July 2025 through 1 August 2025","Vienna","213612","English","Conference paper","Final","","Scopus"
"Liu S.; Gemp I.; Marris L.; Piliouras G.; Heess N.; Lanctot M.","Liu, Siqi (57204572082); Gemp, Ian (36082211900); Marris, Luke (57208440775); Piliouras, Georgios (35113645700); Heess, Nicolas (36450421000); Lanctot, Marc (56522887100)","57204572082; 36082211900; 57208440775; 35113645700; 36450421000; 56522887100","RE-EVALUATING OPEN-ENDED EVALUATION OF LARGE LANGUAGE MODELS","2025","13th International Conference on Learning Representations, ICLR 2025","","","","51077","51104","","https://www.scopus.com/inward/record.uri?eid=2-s2.0-105010277265&partnerID=40&md5=3b922653ed5183eb93f07c0a356ff7cb","Evaluation has traditionally focused on ranking candidates for a specific skill. Modern generalist models, such as Large Language Models (LLMs), decidedly outpace this paradigm. Open-ended evaluation systems, where candidate models are compared on user-submitted prompts, have emerged as a popular solution. Despite their many advantages, we show that the current Elo-based rating systems can be susceptible to and even reinforce biases in data, intentional or accidental, due to their sensitivity to redundancies. To address this issue, we propose evaluation as a 3-player game, and introduce novel game-theoretic solution concepts to ensure robustness to redundancy. We show that our method leads to intuitive ratings and provide insights into the competitive landscape of LLM development. © 2025 13th International Conference on Learning Representations, ICLR 2025. All rights reserved.","","'current; Candidate models; Game-theoretic; Language model; Model development; Rating system; Solution concepts; Game theory","","13th International Conference on Learning Representations, ICLR 2025","24 April 2025 through 28 April 2025","Singapore","209472","English","Conference paper","Final","","Scopus"
"Feng J.; Ning Y.; Wang Z.; Li G.; Xiu Xu S.","Feng, Jianghong (57218395456); Ning, Yu (57195529316); Wang, Zhaohua (57192245952); Li, Guo (7407055832); Xiu Xu, Su (35773963700)","57218395456; 57195529316; 57192245952; 7407055832; 35773963700","ChatGPT-enabled two-stage auctions for electric vehicle battery recycling","2024","Transportation Research Part E: Logistics and Transportation Review","183","","103453","","","10.1016/j.tre.2024.103453","https://www.scopus.com/inward/record.uri?eid=2-s2.0-85184818998&doi=10.1016%2Fj.tre.2024.103453&partnerID=40&md5=3bddda6e59493ac8728fd1d7002b91c0","The primary objective of this study is to create an advanced management system that seamlessly integrates ChatGPT, an intelligent chatbot, with a cutting-edge two-stage auctions model. This integration aims to optimize the recycling process of electric vehicle batteries, ensuring utmost efficiency. To gauge the effect of incorporating ChatGPT on participants' values, we introduce technology coefficient parameters, providing a deeper understanding of its impact. In the initial phase of the auction, a sophisticated platform or an impartial third-party appraisal firm is employed. Their task is to collect vital attribute information from potential sellers regarding the waste batteries. Subsequently, this information is carefully matched with interested buyers. To determine the appropriate number of buyers both before and after the auction, we introduce two innovative matching mechanisms. We propose the implementation of a pioneering one-sided affine VCG (Vickrey-Clarke-Groves) auction, which portrays the affine externality of buyers to other buyers, along with a weighted generalized second-price auction. Additionally, we introduce a ground-breaking mechanism known as weighted multi-unit trade reduction. This inventive process allows successful bidders from the first stage to actively participate in the subsequent auction. Within this paper, we develop auction allocation rules based on the interplay between winning sellers' supply and winning buyers' demand. The outcomes of our numerical studies demonstrate the efficacy of the two-stage auction method in addressing buyers' concerns regarding battery performance. Furthermore, we have found that the utilization of ChatGPT technology proves advantageous for both participants and the platform; if buyers have a positive affine externality on other buyers, then the platform's revenue will be reduced, while social welfare will increase. In the realm of incentive compatibility, individual rationality, and budget balancing, our proposed mechanism stands unwaveringly strong, having undergone rigorous scrutiny and demonstrating commendable performance in numerous numerical experiments. Lastly, we offer practical management insights for stakeholders in the battery recycling market. These invaluable insights are derived from our hands-on experience, providing a fresh perspective for industry managers. © 2024 Elsevier Ltd","Battery recycling; ChatGPT; Information matching; Mechanism design; Two-stage auctions","Budget control; Commerce; Machine design; Numerical methods; Sales; Battery recycling; Chatbots; ChatGPT; Electric vehicle batteries; Information matching; Management systems; Matchings; Mechanism design; Primary objective; Two-stage auction; artificial intelligence; design; electric vehicle; electronic waste; model; recycling; Recycling","","","","","","English","Article","Final","","Scopus"
