C;"Mozikov, M; Severin, N; Bodishtianu, V; Glushanina, M; Nasonov, I; Orekhov, D; Pekhotin, V; Makovetskiy, I; Baklashkin, M; Lavrentyev, V; Tsvigun, A; Turdakov, D; Shavrina, T; Saychenko, A; Makarov, I";;"Globerson, A; Mackey, L; Belgrave, D; Fan, A; Paquet, U; Tomczak, J; Zhang, C";;"Mozikov, Mikhail; Severin, Nikita; Bodishtianu, Valeria; Glushanina, Maria; Nasonov, Ivan; Orekhov, Daniil; Pekhotin, Vladislav; Makovetskiy, Ivan; Baklashkin, Mikhail; Lavrentyev, Vasily; Tsvigun, Akim; Turdakov, Denis; Shavrina, Tatiana; Saychenko, Andrey; Makarov, Ilya";;;EAI: Emotional Decision-Making of LLMs in Strategic Games and Ethical Dilemmas;ADVANCES IN NEURAL INFORMATION PROCESSING SYSTEMS 37 (NEURIPS 2024);Advances in Neural Information Processing Systems;;English;Proceedings Paper;2024 38th Conference on Neural Information Processing Systems-NeurIPS;DEC 10-15, 2024;Vancouver, CANADA;;;;"DICTATOR GAME; FAIRNESS; RATIONALITY; COOPERATION; HAPPINESS; SADNESS; DISGUST";One of the urgent tasks of artificial intelligence is to assess the safety and alignment of large language models (LLMs) with human behavior. Conventional verification only in pure natural language processing benchmarks can be insufficient. Since emotions often influence human decisions, this paper examines LLM alignment in complex strategic and ethical environments, providing an in-depth analysis of the drawbacks of our psychology and the emotional impact on decision-making in humans and LLMs. We introduce the novel EAI framework for integrating emotion modeling into LLMs to examine the emotional impact on ethics and LLM-based decision-making in various strategic games, including bargaining and repeated games. Our experimental study with various LLMs demonstrated that emotions can significantly alter the ethical decision-making landscape of LLMs, highlighting the need for robust mechanisms to ensure consistent ethical standards. Our game-theoretic analysis revealed that LLMs are susceptible to emotional biases influenced by model size, alignment strategies, and primary pretraining language. Notably, these biases often diverge from typical human emotional responses, occasionally leading to unexpected drops in cooperation rates, even under positive emotional influence. Such behavior complicates the alignment of multiagent systems, emphasizing the need for benchmarks that can rigorously evaluate the degree of emotional alignment. Our framework provides a foundational basis for developing such benchmarks.;;;;;;;;;;;;;;;;;;;;;;;;;2024;;;;;;;;;;;;;;34;;;Computer Science;;;;;;;WOS:001633285000064;View Full Record in Web of Science
C;"Wang, HC; Zhao, SD; Wang, JB; Qiang, ZW; Qin, B; Liu, T";;"Che, W; Nabende, J; Shutova, E; Pilehvar, MT";;"Wang, Haochun; Zhao, Sendong; Wang, Jingbo; Qiang, Zewen; Qin, Bing; Liu, Ting";;;Beyond Frameworks: Unpacking Collaboration Strategies in Multi-Agent Systems;PROCEEDINGS OF THE 63RD ANNUAL MEETING OF THE ASSOCIATION FOR COMPUTATIONAL LINGUISTICS, VOL 1: LONG PAPERS;;;English;Proceedings Paper;63rd Association for Computational Linguistics Meeting-ACL-Annual;JUL 27-AUG 01, 2025;Vienna, AUSTRIA;;;;;Multi-agent collaboration has emerged as a pivotal paradigm for addressing complex, distributed tasks in large language model (LLM)-driven applications. While prior research has focused on high-level architectural frameworks, the granular mechanisms governing agents, critical to performance and scalability, remain underexplored. This study systematically investigates four dimensions of collaboration strategies: (1) agent governance, (2) participation control, (3) interaction dynamics, and (4) dialogue history management. Through rigorous experimentation under two context-dependent scenarios: Distributed Evidence Integration (DEI) and Structured Evidence Synthesis (SES), we quantify the impact of these strategies on both task accuracy and computational efficiency. Our findings reveal that centralized governance, instructor-led participation, ordered interaction patterns, and instructor-curated context summarization collectively optimize the trade-off between decision quality and resource utilization with the support of the proposed Token-Accuracy Ratio (TAR). This work establishes a foundation for designing adaptive, scalable multi-agent systems, shifting the focus from structural novelty to strategic interaction mechanics.;;;;;;;;;;;;;;;;;;;;;;;;;2025;;;;;;;21361;21375;;;;;;15;;;"Computer Science; Linguistics";;;;;;;WOS:001611625300075;View Full Record in Web of Science
C;"Bachrach, Y; Toledo, E; Hambardzumyan, K; Magka, D; Josifoski, M; Jiang, MQ; Foerster, J; Raileanu, R; Shavrina, T; Cancedda, N; Ruderman, A; Millican, K; Lupu, A; Hazra, R";;Kwok, J;;"Bachrach, Yoram; Toledo, Edan; Hambardzumyan, Karen; Magka, Despoina; Josifoski, Martin; Jiang, Minqi; Foerster, Jakob; Raileanu, Roberta; Shavrina, Tatiana; Cancedda, Nicola; Ruderman, Avraham; Millican, Katie; Lupu, Andrei; Hazra, Rishi";;;Combining Code Generating Large Language Models and Self-Play to Iteratively Refine Strategies in Games;PROCEEDINGS OF THE THIRTY-FOURTH INTERNATIONAL JOINT CONFERENCE ON ARTIFICIAL INTELLIGENCE (IJCAI 2025);;;English;Proceedings Paper;34th International Joint Conference on Artificial Intelligence-IJCAI;AUG 16-22, 2025;Montreal, CANADA;;;;"CHECKERS; LEVEL";We propose a self-play approach to generating strategies for playing in multi-player games, where strategies are represented as computer code. We use large language models (LLMs) to generate pieces of code to play in the game, which we refer to as generated bots. We engage the LLM generated bots in competitions, designed to generate increasingly stronger strategies. We follow game theoretic principles in organizing these tournaments, and use a Policy Space Response Oracle (PSRO) approach. We start with an initial set of LLM generated bots, and continue in rounds for adding new bots into the population. Each round adds a bot to the population by asking the LLM to produce code for playing against a bot representing the Nash equilibrium mixture over the current population. Our analysis shows that even a few rounds are sufficient to produces strong bots for playing the game. Our demo shows the process for the game of Checkers. We allow users to select initial bots in the population, run the process, inspect how the bots evolve over time, and play against the generated bots.;;;;;;;;;;;;;;;;;;;;;;;;;2025;;;;;;;10999;11003;;;;;;5;;;Computer Science;;;;;;;WOS:001634925300605;View Full Record in Web of Science
C;"Suzuki, R; Arita, T";;;IEEE;"Suzuki, Reiji; Arita, Takaya";;;Evolutionary ecology of words;2025 IEEE SYMPOSIUM ON COMPUTATIONAL INTELLIGENCE IN ARTIFICIAL LIFE AND COOPERATIVE INTELLIGENT SYSTEMS, ALIFE-CIS;;;English;Proceedings Paper;2025 Symposium on Computational Intelligence in Artificial Life and Cooperative Intelligent Systems-ALIFE-CIS;MAR 17-20, 2025;Trondheim, NORWAY;;;"large language models; agent-based models; evolutionary game theory; artificial life";;We propose a model for the evolutionary ecology of words as one attempt to extend evolutionary game theory and agent-based models by utilizing the rich linguistic expressions of Large Language Models (LLMs). Our model enables the emergence and evolution of diverse and infinite options for interactions among agents. Within the population, each agent possesses a short word (or phrase) generated by an LLM and moves within a spatial environment. When agents become adjacent, the outcome of their interaction is determined by the LLM based on the relationship between their words, with the loser's word being replaced by the winner's. Word mutations, also based on LLM outputs, may occur. We conducted preliminary experiments assuming that strong animal species would survive. The results showed that from an initial population consisting of well-known species, many species emerged both gradually and in a punctuated equilibrium manner. Each trial demonstrated the unique evolution of diverse populations, with one type of large species becoming dominant, such as terrestrial animals, marine life, or extinct species, which were ecologically specialized and adapted ones across diverse extreme habitats. We also conducted a long-term experiment with a large population, demonstrating the emergence and coexistence of diverse species.;;;;;;;;;;;;;;;;;;;;;;;;;2025;;;;;;;;;;10.1109/ALIFE-CIS64968.2025.10979831;http://dx.doi.org/10.1109/ALIFE-CIS64968.2025.10979831;;;7;;;Computer Science;;;Green Submitted;;;;WOS:001511632400003;View Full Record in Web of Science
C;"Yim, YW; Chan, CK; Shi, TY; Deng, ZY; Fan, W; Zheng, TS; Song, YQ";;;IEEE COMPUTER SOC;"Yim, Yauwai; Chan, Chunkit; Shi, Tianyu; Deng, Zheye; Fan, Wei; Zheng, Tianshi; Song, Yangqiu";;;Evaluating and Enhancing LLMs Agent based on Theory of Mind in Guandan: A Multi-Player Cooperative Game under Imperfect Information;2024 IEEE/WIC INTERNATIONAL CONFERENCE ON WEB INTELLIGENCE AND INTELLIGENT AGENT TECHNOLOGY, WI-IAT;;;English;Proceedings Paper;2024 International Conference on Web Intelligence and Intelligent Agent Technology-WI-IAT;DEC 09-12, 2024;THAILAND;;;"LLM Agent; Multi-agent Collaboration; Theory of Mind";;Large language models (LLMs) have shown success in handling simple games with imperfect information and enabling multi-agent coordination, but their ability to facilitate practical collaboration against other agents in complex, imperfect information environments, especially in a non-English environment, still needs to be explored. This study investigates the applicability of knowledge acquired by open-source and API-based LLMs to sophisticated text-based games requiring agent collaboration under imperfect information, comparing their performance to established baselines using other types of agents. We propose a Theory of Mind (ToM) planning technique that allows LLM agents to adapt their strategy against various adversaries using only game rules, current state, and historical context as input. An external tool was incorporated to mitigate the challenge of dynamic and extensive action spaces in this card game. Our results show that although a performance gap exists between current LLMs and state-of-the-art reinforcement learning (RL) models, LLMs demonstrate ToM capabilities in this game setting. It consistently improves their performance against opposing agents, suggesting their ability to understand the actions of allies and adversaries and establish collaboration with allies. To encourage further research and understanding, we have made our codebase openly accessible.;;;;;;;;;;;;;;;;;;;;;;;;;2024;;;;;;;461;465;;10.1109/WI-IAT62293.2024.00074;http://dx.doi.org/10.1109/WI-IAT62293.2024.00074;;;5;;;"Computer Science; Engineering; Telecommunications";;;;;;;WOS:001517268400066;View Full Record in Web of Science
J;"Sadoune, I; Joanis, M; Lodi, A";;;;"Sadoune, Igor; Joanis, Marcelin; Lodi, Andrea";;;Implementing a Hierarchical Deep Learning Approach for Simulating Multilevel Auction Data;COMPUTATIONAL ECONOMICS;;;English;Article;;;;;;"Simulation crafting; Discrete deep generative modeling; Multilevel discrete data; Auction data";MODEL;We present a deep learning solution to address the challenges of simulating realistic synthetic first-price sealed-bid auction data. The complexities encountered in this type of auction data include high-cardinality discrete feature spaces and a multilevel structure arising from multiple bids associated with a single auction instance. Our methodology combines deep generative modeling (DGM) with an artificial learner that predicts the conditional bid distribution based on auction characteristics, contributing to advancements in simulation-based research. This approach lays the groundwork for creating realistic auction environments suitable for agent-based learning and modeling applications. Our contribution is twofold: we introduce a comprehensive methodology for simulating multilevel discrete auction data, and we underscore the potential of DGM as a powerful instrument for refining simulation techniques and fostering the development of economic models grounded in generative AI.;;;;;;;;;;;;;;;;;;;;;;;;APR;2025;65;4;;;;;2029;2056;;10.1007/s10614-024-10622-4;http://dx.doi.org/10.1007/s10614-024-10622-4;;MAY 2024;28;;;"Business & Economics; Mathematics";;;;;;;WOS:001226664900003;View Full Record in Web of Science
J;"Cohen, G; Aiche, A; Winer, Z";;;;"Cohen, Gil; Aiche, Avishay; Winer, Zvi";;;Matching angels to startups using AI;CHINA FINANCE REVIEW INTERNATIONAL;;;English;"Article; Early Access";;;;;;"Angel investing; Matching process; Artificial intelligence; Game theory; Predictive modeling; Decision-making; Entrepreneurship; Start-up ecosystem";INVESTMENT;PurposeThis paper introduces an innovative approach to analyzing the matching process between angel investors and start-up companies, utilizing a combination of artificial intelligence (AI) technologies and game-theoretic models. By harnessing the capabilities of AI engines such as Gemini and ChatGPT 4, we extract valuable insights from real-world data, identifying influential criteria that drive investment decisions on both sides of the equation.Design/methodology/approachLeveraging historical investment patterns and behaviors, Gemini identifies key criteria that angel investors prioritize when evaluating start-up opportunities. We then employ R programming simulation to evaluate the predictive quality of these criteria and optimize cutoff values using the Youden index, balancing sensitivity and specificity in the matching process.FindingsOur findings underscore the importance of integrating qualitative preferences and quantitative criteria in the matching process, offering a comprehensive framework for guiding strategic investment decisions in the entrepreneurial ecosystem. By comparing and contrasting the results obtained from different methodologies, we gain valuable insights into the complexities and dynamics of the investment landscape, paving the way for informed decision-making and strategic partnerships. Our research contributes to advancing the field of angel investing, offering practical insights and tools to support investors, entrepreneurs and stakeholders in navigating the dynamic and evolving landscape of early-stage investment.Originality/valueThis is the first attempt to utilize AI in the matching process between startups and angel investors.;;;;;;;;;;;;;;;;;;;;;;;;2025 MAY 9;2025;;;;;;;;;;10.1108/CFRI-04-2024-0222;http://dx.doi.org/10.1108/CFRI-04-2024-0222;;MAY 2025;17;;;Business & Economics;;;;;;;WOS:001483502900001;View Full Record in Web of Science
C;"Zhang, YD; Mao, SG; Ge, T; Wang, X; Xia, Y; Lan, M; Wei, FR";Ritter, A;"Chiruzzo, L; Wang, L";;"Zhang, Yadong; Mao, Shaoguang; Ge, Tao; Wang, Xun; Xia, Yan; Lan, Man; Wei, Furu";Ritter, A;;K-Level Reasoning: Establishing Higher Order Beliefs in Large Language Models for Strategic Reasoning;PROCEEDINGS OF THE 2025 CONFERENCE OF THE NATIONS OF THE AMERICAS CHAPTER OF THE ASSOCIATION FOR COMPUTATIONAL LINGUISTICS: HUMAN LANGUAGE TECHNOLOGIES, VOL 1: LONG PAPERS;;;English;Proceedings Paper;2025 Conference of the North American Chapter of the Association for Computational Linguistics-NAACL;APR 29-MAY 04, 2025;MEXICO;;;;;Strategic reasoning is a complex yet essential capability for intelligent agents. It requires Large Language Model (LLM) agents to adapt their strategies dynamically in multi-agent environments. Unlike static reasoning tasks, success in these contexts depends on anticipating other agents' beliefs and actions while continuously adjusting strategies to achieve individual goals. LLMs and LLM agents often struggle with strategic reasoning due to the absence of a reasoning framework that enables them to dynamically infer others' perspectives and adapt to changing environments. Inspired by the Level-K framework 1 from game theory and behavioral economics, which extends reasoning from simple reactions to structured strategic depth, we propose a novel framework: K-Level Reasoning with Large Language Models (K-R). This framework employs recursive mechanisms to enable LLMs to achieve varying levels of strategic depth, allowing agents to form higher order beliefs-beliefs about others' beliefs. We validate this framework through rigorous testing on four testbeds: two classical game theory problems and two social intelligence tasks. The results demonstrate the advantages of K-R in strategic reasoning. Our work presents the first recursive implementation of strategic depth in large language models (LLMs). It establishes a foundation for future research into theory of mind and strategic reasoning in LLMs.;;;;;;;;;;;;;;;;;;;;;;;;;2025;;;;;;;7212;7234;;;;;;23;;;"Computer Science; Linguistics";;;;;;;WOS:001611654000051;View Full Record in Web of Science
J;"de Zarzŕ, I; de Curtň, J; Roig, G; Manzoni, P; Calafate, CT";;;;"de Zarza, I.; de Curto, J.; Roig, Gemma; Manzoni, Pietro; Calafate, Carlos T.";;;Emergent Cooperation and Strategy Adaptation in Multi-Agent Systems: An Extended Coevolutionary Theory with LLMs;ELECTRONICS;;;English;Article;;;;;;"multi-agent systems; human-computer interaction; large language models; cooperative games; game theory";ALGORITHM;The increasing complexity of Multi-Agent Systems (MASs), coupled with the emergence of Artificial Intelligence (AI) and Large Language Models (LLMs), have highlighted significant gaps in our understanding of the behavior and interactions of diverse entities within dynamic environments. Traditional game theory approaches have often been employed in this context, but their utility is limited by the static and homogenous nature of their models. With the transformative influence of AI and LLMs on business and society, a more dynamic and nuanced theoretical framework is necessary to guide the design and management of MASs. In response to this pressing need, we propose an Extended Coevolutionary (EC) Theory in this paper. This alternative framework incorporates key aspects of coevolutionary dynamics, adaptive learning, and LLM-based strategy recommendations to model and analyze the strategic interactions among heterogeneous agents in MASs. It goes beyond game theory by acknowledging and addressing the diverse interactions (economic transactions, social relationships, information exchange) and the variability in risk aversion, social preferences, and learning capabilities among entities. To validate the effectiveness of the EC framework, we developed a simulation environment that enabled us to explore the emergence of cooperation and defection patterns in MASs. The results demonstrated the potential of our framework to promote cooperative behavior and maintain robustness in the face of disruptions. The dynamics and evolution of the Multi-Agent System over time were also visualized using advanced techniques. Our findings underscore the potential of harnessing LLMs to facilitate cooperation, enhance social welfare, and promote resilient strategies in multi-agent environments. Moreover, the proposed EC framework offers valuable insights into the interplay between strategic decision making, adaptive learning, and LLM-informed guidance in complex, evolving systems. This research not only responds to the current challenges faced in modeling MASs, but also paves the way for future research in this rapidly developing field.;;;;;;;;;;;;;;;;;;;;;;;;JUN;2023;12;12;;;;;;;2722;10.3390/electronics12122722;http://dx.doi.org/10.3390/electronics12122722;;;19;;;"Computer Science; Engineering; Physics";;;Green Submitted, gold;;;;WOS:001016969200001;View Full Record in Web of Science
C;"Sun, HR; Wu, YS; Cheng, YK; Chu, X";;Kwok, J;;"Sun, Haoran; Wu, Yusen; Cheng, Yukun; Chu, Xu";;;Game Theory Meets Large Language Models: A Systematic Survey;PROCEEDINGS OF THE THIRTY-FOURTH INTERNATIONAL JOINT CONFERENCE ON ARTIFICIAL INTELLIGENCE (IJCAI 2025);;;English;Proceedings Paper;34th International Joint Conference on Artificial Intelligence-IJCAI;AUG 16-22, 2025;Montreal, CANADA;;;;;"Game theory establishes a fundamental framework for analyzing strategic interactions among rational decision-makers. The rapid advancement of large language models (LLMs) has sparked extensive research exploring the intersection of these two fields. Specifically, game-theoretic methods are being applied to evaluate and enhance LLM capabilities, while LLMs themselves are reshaping classic game models. This paper presents a comprehensive survey of the intersection of these fields, exploring a bidirectional relationship from three perspectives: (1) Establishing standardized game-based benchmarks for evaluating LLM behavior; (2) Leveraging gametheoretic methods to improve LLM performance through algorithmic innovations; (3) Characterizing the societal impacts of LLMs through game modeling. Among these three aspects, we also highlight how the equilibrium analysis for traditional game models is impacted by LLMs' advanced language understanding, which in turn extends the study of game theory. Finally, we identify key challenges and future research directions, assessing their feasibility based on the current state of the field. By bridging theoretical rigor with emerging AI capabilities, this survey aims to foster interdisciplinary collaboration and drive progress in this evolving research area.";;;;;;;;;;;;;;;;;;;;;;;;;2025;;;;;;;10669;10677;;;;;;9;;;Computer Science;;;;;;;WOS:001634925300540;View Full Record in Web of Science
C;"Xia, T; He, ZW; Ren, T; Miao, YB; Zhang, ZS; Yang, Y; Wang, R";;"Martins, A; Srikumar, V; Ku, LW";;"Xia, Tian; He, Zhiwei; Ren, Tong; Miao, Yibo; Zhang, Zhuosheng; Yang, Yang; Wang, Rui";;;Measuring Bargaining Abilities of LLMs: A Benchmark and A Buyer-Enhancement Method;FINDINGS OF THE ASSOCIATION FOR COMPUTATIONAL LINGUISTICS: ACL 2024;;;English;Proceedings Paper;62nd Annual Meeting of the Association-for-Computational-Linguistics (ACL) / Student Research Workshop (SRW);AUG 11-16, 2024;Bangkok, THAILAND;;;;;Bargaining is an important and unique part of negotiation between humans. As LLM-driven agents learn to negotiate and act like real humans, how to evaluate agents' bargaining abilities remains an open problem. For the first time, we formally described the Bargaining task as an asymmetric incomplete information game, defining the gains of the Buyer and Seller in multiple bargaining processes. It allows us to quantitatively assess an agent's performance in the Bargain task. We collected a real product price dataset, AmazonHistoryPrice, and conducted evaluations of various LLM agents' bargaining abilities(1). We find that playing a Buyer is much harder than a Seller, and increasing model size can not effectively improve the Buyer's performance. To address the challenge, we propose a novel approach called OG-Narrator that integrates a deterministic Offer Generator to control the price range of Buyer's offers, and an LLM Narrator to create natural language sentences for generated offers. Experimental results show that OG-Narrator improves the buyer's deal rates from 26.67% to 88.88% and brings a ten times multiplication of profits on all baselines, even a model that has not been aligned.;;;;;;;;;;;;;;;;;;;;;;;;;2024;;;;;;;3579;3602;;;;;;24;;;Computer Science;;;;;;;WOS:001356731803046;View Full Record in Web of Science
C;"Ye, XP; Xu, C; Sun, ZX; Xu, J; Wang, G; Dong, ZH; Wen, JR";;;ACM;"Ye, Xiaopeng; Xu, Chen; Sun, Zhongxiang; Xu, Jun; Wang, Gang; Dong, Zhenhua; Wen, Ji-Rong";;;LLM-Empowered Creator Simulation for Long-Term Evaluation of Recommender Systems Under Information Asymmetry;PROCEEDINGS OF THE 48TH INTERNATIONAL ACM SIGIR CONFERENCE ON RESEARCH AND DEVELOPMENT IN INFORMATION RETRIEVAL, SIGIR 2025;;;English;Proceedings Paper;48th Conference on Research and Development in Information Retrieval-RDIR;JUL 13-18, 2025;ITALY;;;"Long-term Evaluation; Content Creator; Information Asymmetry; LLM-empowered Agent";;Maintaining the long-term sustainability of recommender systems (RS) is crucial. Traditional RS evaluation methods primarily focus on the user's immediate feedback (e.g., click), however, they often overlook the long-term effect involved by the content creators. In the real world, content creators can strategically create and upload new items to the platform by analyzing users' feedback and preference trends. Although previous studies have attempted to model creator behaviors, they often overlook that such behaviors are under conditions of information asymmetry. This asymmetry arises because creators mainly access the user feedback on the items they produce, while the platform has access to the full spectrum of feedback data. However, existing RS simulators often fail to consider such a condition, making the long-term RS evaluation inaccurate. To bridge this gap, we propose a Large Language Model (LLM)empowered creator simulation agent named CreAgent. By utilizing the belief mechanism from game theory and the fast-and-slowthinking framework, we can simulate the creator's behaviors well under information asymmetry. Furthermore, to enhance CreAgent's simulation ability, we utilize Proximal Policy Optimization to fine-tune CreAgent. Our credibility validation experiments demonstrate that our simulation environment effectively aligns with the behaviors of real-world platforms and creators, thereby enhancing the reliability of long-term evaluations in RS. Furthermore, leveraging this simulator, we can examine whether RS algorithms, such as fairnessand diversity-aware methods, contribute to improving long-term performance for different stakeholders.;;;;;;;;;;;;;;;;;;;;;;;;;2025;;;;;;;201;211;;10.1145/3726302.3730026;http://dx.doi.org/10.1145/3726302.3730026;;;11;;;Computer Science;;;gold;;;;WOS:001587983900022;View Full Record in Web of Science
